text,wakati_text
"死刑求刑で色んな意見があるけど、廃止なら死刑に変わる刑ってどんなものかいいのかな？
前に刑を終えて刑務所を出て、直ぐにまた殺人を犯した人が居て、生活に困って再び刑務所に入りたいから
が理由だったようだし",死刑 求刑 色んな 意見 ある 廃止 死刑 変わる 刑 もの いい 前 刑 終える 刑務所 出る 直ぐだ 殺人 犯す 人 居る 生活 困る 刑務所 入る たい 理由
"新潟女児殺害の被告に死刑求刑
#新潟女児殺害
https://t.co/c6DGvsnJjN",新潟 女児 殺害 被告 死刑 求刑 新潟 女児 殺害
新潟女児殺害　被告に死刑求刑 https://t.co/RA8oAR3Rgv  #裁判員裁判 #新潟市西区 #新潟県新潟市 #今日のニュース,新潟 女児 殺害 被告 死刑 求刑 裁判 員 裁判 新潟 市 西 区 新潟 県 新潟 市 今日 ニュース
新潟女児殺害、被告に死刑求刑「まれにみる非道な犯行」（朝日新聞デジタル） - Yahoo!ニュース https://t.co/LY5BB8xkou,新潟 女児 殺害 被告 死刑 求刑 まれだ みる 非道だ 犯行 朝日新聞 デジタル ニュース
今トレンドに上がってる「死刑求刑」というワード、すぐにグロ画像出てくるのでトレンドワード見ないことをオススメします。,トレンド 上がる る 死刑 求刑 いう ワード グロだ 画像 出る くる 見る ない こと オススメ する ます
もうすぐ半年ニートなので死刑求刑してください,半年 ニート 死刑 求刑 する くださる
"求刑通り死刑かな
内容は悪逆非道だけど年齢も年齢だからどうなるか...

終身刑でも税金無駄遣いして欲しくない",求刑 通り 死刑 かな 内容 悪逆 非道だ 年齢 年齢 なる 終身 刑 税金 無駄遣い する 欲しい ない
死刑求刑何事かと思ったら新潟であったやつか… 本当に地元の地元で起きた事件だったから他人事とは思えない,死刑 求刑 何事 思う 新潟 やつ 本当だ 地元 地元 起きる 事件 他人事 思える ない
「ほんだしけぇ休憩」には「死刑求刑」が含まれている。,ほん しけ 休憩 死刑 求刑 含む れる いる
死刑求刑で命は大切だから死刑はとか言う人もいるが死んでもいい奴なんかいっぱいいると思うが。,死刑 求刑 命 大切だ 死刑 言う 人 いる 死ぬ いい 奴 いる 思う
"=͟͟͞͞(꒪⌓꒪*)
死刑求刑

日本のトレンド、、

=͟͟͞͞(꒪⌓꒪*) https://t.co/7VHTWWq1v0",死刑 求刑 日本 トレンド
新潟女児殺害、被告に死刑求刑「まれにみる非道な犯行」：朝日新聞デジタル https://t.co/uv1k88Th9J,新潟 女児 殺害 被告 死刑 求刑 まれだ みる 非道だ 犯行 朝日新聞 デジタル
"RT @AnnaHonjyou: 昨年５月７日
下校中の女児の背後から軽乗用車を衝突させて連れ去り
わいせつな行為をした後、首を絞めて殺害。
同日夜、女児の遺体をＪＲ越後線の線路上に遺棄し
列車にはねさせた。

極悪非道・死刑求刑でも足りないと思う。

＃死刑求刑 ＃新潟女児殺…",昨年 ５ 月 ７ 日 下校 中 女児 背後 軽 乗用車 衝突 する せる 連れる 去る わいせつだ 行為 する 後 首 絞める 殺害 同日 夜 女児 遺体 ＪＲ 越後 線 線路 上 遺棄 する 列車 はねる させる 極悪 非道だ 死刑 求刑 足りる ない 思う 死刑 求刑 新潟 女児 殺
死刑求刑でグロ画像流した奴とか罪に出来ないものか,死刑 求刑 グロだ 画像 流す 奴 罪 出来る ない もの
"親御さんの気持ちを考えたら…同じ親としては死刑求刑でも心は充足されないよ…

新潟女児殺害事件 母親「娘は何度も何度も被告に殺された」 #ldnews https://t.co/8s0AqOhsjG",親御さん 気持ち 考える 同じだ 親 する 死刑 求刑 心す 充 足 れる い 新 潟 女 児 殺す 害 事 件 母 親 娘 何 度 何 度 告ぐ 殺す れる たい
"去年の新潟でのロリコン殺人で死刑求刑か。

家に警察が来て
｢お宅に高校出た息子さん居るみたいですが何してるんですか？｣
｢.......浪人です。｣
｢あっ.......ゴメンなさい.......｣

とやり取りした記憶が.......。",去年 新潟 ロリコン 殺人 死刑 求刑 家 警察 来る お宅 高校 出る 息子 さん 居る 何 する る 浪人 ある ゴメン なさる やり取り する 記憶 .
"死刑求刑のタグにもうんざりする。死刑反対の人に対して「身内が同じ目に遭っても言えるのか！」
という感情論は雑すぎる。
「はい、言えます」
と応えたらどうすんだよ。",死刑 求刑 タグ する 死刑 反対 人 対する 身内 同じだ 目 遭う 言える いう 感情 論 雑だ すぎる 言える ます 応える すむ
新潟女児殺害、被告に死刑求刑「まれにみる非道な犯行」：朝日新聞デジタル https://t.co/QdyyGZDn4j,新潟 女児 殺害 被告 死刑 求刑 まれだ みる 非道だ 犯行 朝日新聞 デジタル
痴漢されるだけでも死んで詫びろって怒り狂うのに、死刑求刑して何が悪いのかと思うわ,痴漢 する れる 死ぬ 詫びる 怒り狂う 死刑 求刑 する 何 悪い 思う
新潟女児殺害、被告に死刑求刑「まれにみる非道な犯行」 https://t.co/L4pfbKN3GF,新潟 女児 殺害 被告 死刑 求刑 まれだ みる 非道だ 犯行
"江東マンション神隠し殺人事件は、
無期懲役だったな。

性奴隷目的で女性を拉致、
警察が来たのでバラバラにして下水に捨てた事件。

新潟・女児殺害　被告に死刑求刑　新潟地裁 - 毎日新聞 https://t.co/e1u3dCZPRI",江東 マンション 神 隠し 殺人 事件 無期 懲役 性 奴隷 目的 女性 拉致 警察 来る バラバラだ する 下水 捨てる 事件 新潟 女児 殺害 被告 死刑 求刑 新潟 地裁 毎日新聞
"凶悪犯には死刑求刑はもちろんですが、「前奏曲」としてまずこれはどうですか？
#懲役30日 
#世にも奇妙な物語 https://t.co/0OK6fRqKXq",凶悪だ 犯 死刑 求刑 前奏 曲 する 懲役 30 日 奇妙だ 物語
RT @asahi: 新潟女児殺害、被告に死刑求刑「まれにみる非道な犯行」 https://t.co/QZLCAdBECB,
"死刑制度が再び話題になっているが
この求刑は妥当だの当然だの言ってる人らって所詮野次馬でしかないよなあと思ってしまった",死刑 制度 話題 なる いる 求刑 妥当だ 当然だ 言う る 人 ら 野次馬 ない 思う しまう
RT @mokkosu6: 【新潟女児殺害】小林被告に死刑求刑 「まれにみる非道な犯行」 https://t.co/euYeVUXf2G☆気になったらRT！ #新潟女児殺害,新潟 女児 殺害
死刑求刑で弁護士がなんで弁護するんだって言ってる人いるけどそりゃ仕事だからです。確かに被害者遺族には申し訳ないが弁護しないわけにはいかないんだよそれが仕事だから。食っていくために仕事をするという社会でごく当たり前のことだと思うが,死刑 求刑 弁護 士 弁護 する 言う る 人 いる 仕事 確かだ 被害 者 遺族 申し訳ない 弁護 する ない いく ない 仕事 食う いく ため 仕事 する いう 社会 当たり前だ こと 思う
"うーん…
新潟の事件の死刑求刑に対する反対派の意見って…
賛成派が感情的でワロスみたいなのは想像力が欠如してるんだろうか。
自分が被害者の親の立場になって、犯人の生い立ちなんかがあって同情して仕方ない、事故にあったようなものだと納得できるかを催眠術とかで実験してみたらいいかもね。",新潟 事件 死刑 求刑 対する 反対 派 意見 賛成 派 感情 的だ ワロス の 想像 力 欠如 する る 自分 被害 者 親 立場 なる 犯人 生い立ち ある 同情 する 仕方ない 事故 ある もの 納得 できる 催眠 術 実験 する みる いい
死刑求刑のトレンド見たらグロ画像見てしまった最悪無理。それをスクショしてこれはだめだろって載せてるやつも同じだからな。はー無理！,死刑 求刑 トレンド 見る グロだ 画像 見る しまう 最悪だ 無理 スクショ する だめだ 載せる る やつ 同じだ 無理
"@nhk_shutoken #池袋母子死亡事故 犯人の
#飯塚幸三 にも是非死刑求刑してください
去年５月、新潟市で小学２年生の女の子を殺害し、線路に遺体を遺棄した小林遼被告（２５）の裁判員裁判が新潟地方裁判所で開かれ、検察は被告に死刑を求刑した。
https://t.co/uieFjkStz8
#飯塚幸三を許すな",犯人 飯塚 幸三 死刑 求刑 する くださる 去年 ５ 月 新潟 市 小学 ２ 年生 女の子 殺害 する 線路 遺体 遺棄 する 小林 遼 被告 ２５ 裁判 員 裁判 新潟 地方 裁判 所 開く れる 検察 被告 死刑 求刑 する 飯塚 幸三 許す ない
新潟女児殺害、被告に死刑求刑「まれにみる非道な犯行」（朝日新聞デジタル） - Yahoo!ニュース https://t.co/tt8DfptOYN,新潟 女児 殺害 被告 死刑 求刑 まれだ みる 非道だ 犯行 朝日新聞 デジタル ニュース
"当たり前だろう。非道なことをしておいて、
自分は悪いと思っていないのだから、こんな変態クズは社会から抹殺でいい。　RT 新潟女児殺害、被告に死刑求刑「まれにみる非道な犯行」 https://t.co/05TO8mBYDc #スマートニュース",当たり前だ 非道だ こと する おく 自分 悪い 思う いる ない 変態 クズ 社会 抹殺 いい 新潟 女児 殺害 被告 死刑 求刑 まれだ みる 非道だ 犯行 スマートだ ニュース
"死刑求刑がトレンドだったから調べてみたら再犯だった…何年も問題視されているのに性犯罪ってそのまま放置されてる。何の対策もしない悲しい国。

「新潟女児殺害事件」、それでも性犯罪者の監視はタブーですか @gendai_biz https://t.co/0V4yhoCwTi #現代ビジネス",死刑 求刑 トレンド 調べる みる 犯 何 年 問題 視 する れる いる 性 犯罪 放置 する れる る 対策 する ない 悲しい 国 新潟 女児 殺害 事件 性 犯罪 者 監視 タブー 現代 ビジネス
@NiBuNiBu1500 @zumin_fc 裁判長、この畜生に死刑を求刑します。,裁判 長 畜生 死刑 求刑 する ます
新潟・女児殺害　被告に死刑求刑　新潟地裁 - 毎日新聞 https://t.co/bGCdP7v1JK,新潟 女児 殺害 被告 死刑 求刑 新潟 地裁 毎日新聞
トレンドの死刑求刑っていうタグ見たら1番上に生首のケーキ（かなりリアル）がでてきたから気をつけて。まじびびった,トレンド 死刑 求刑 いう タグ 見る 1 番 上 生首 ケーキ リアルだ でる くる 気 つける まじる びびる
"ほんと求刑通り死刑でいい
成人して尚
首を締めると人がしぬとは思わなかった
なんて思ってる奴は異常だし更正の余地など皆無だ

死刑でも乱暴され首を絞められ列車にひかれてしまった被害者の苦しみや恐怖には程遠いだろ",ほんとだ 求刑 通り 死刑 いい 成人 する 尚 首 締める 人 しぬ 思う ない 思う る 奴 異常だ 更正 余地 皆無だ 死刑 乱暴 する れる 首 絞める られる 列車 ひく れる しまう 被害 者 苦しみ 恐怖 程遠い
新潟女児殺害、被告に死刑求刑「まれにみる非道な犯行」：朝日新聞デジタル https://t.co/kIgM4q9vXI,新潟 女児 殺害 被告 死刑 求刑 まれだ みる 非道だ 犯行 朝日新聞 デジタル
"簡単に死んで欲しくない
女の子が可哀想…
どんなに怖くて痛かったか…
どうやったらそんな酷いことができる人に育つのだろう

新潟女児殺害、被告に死刑求刑「まれにみる非道な犯行」 #ldnews https://t.co/mWOdLNxBek",簡単だ 死ぬ 欲しい ない 女の子 可哀想だ 怖い 痛い やる 酷い こと できる 人 育つ 新潟 女児 殺害 被告 死刑 求刑 まれだ みる 非道だ 犯行
ああ、死刑求刑でグロ画像に誘導か。相変わらず左巻きのやる事は程度が低いな。,死刑 求刑 グロだ 画像 誘導 左 巻き やる 事 程度 低い
アナ雪２ついに公開！死刑求刑 https://t.co/ZW6yBW6DgV,アナだ 雪 ２ 公開 死刑 求刑
"RT @o_malll: グロいの苦手な人は「死刑求刑」って検索しないでください。
本物じゃないけど、グロい画像載せてるひとがいます。",グロ いの 苦手だ 人 死刑 求刑 検索 する くださる 本物 ない グロい 画像 載せる る ひと いる ます
"キムタクのジャッジアイズ やってから、死刑求刑している今回の裁判について弁護士批判の声見るとすごく苦しい気持ちになる
弁護士だって弁護したくて弁護してるわけじゃないのに、。それが司法で決められてるから必要でしてるだけなのにね、。",キムタク やる 死刑 求刑 する いる 今回 裁判 つく 弁護 士 批判 声 見る すごい 苦しい 気持ち なる 弁護 士 弁護 する たい 弁護 する る ない 司法 決める られる る 必要だ る
死刑求刑のやつ,死刑 求刑 やつ
"RT @tokushimapress: 新潟女児殺害、検察側は死刑求刑 ２５歳男に、判決は１２月４日
https://t.co/0EaFudyio2",２５ 歳 男 判決 １２ 月 ４ 日
"RT @sTOmerr: 死刑求刑っていうトレンド、見ない方がいい
グロテスクな画像がトップツイートにあがってる
ほんっっっっっと心臓に悪いわ
即通報した
気をつけてm(_ _)m",死刑 求刑 いう トレンド 見る ない 方 いい グロテスクだ 画像 トップ ツイート あがる る ほん う う う う 心臓 悪い 通報 する 気 つける
"死刑求刑がトレンドに上がってて何かと思った
感情論で『死刑にしろ』みたいなの散見されるね〜面白い",死刑 求刑 トレンド 上がる る 思う 感情 論 死刑 する 散見 する れる ない 面白い
死刑求刑されてるやつ人狼殺の評価を下げるのはいいけどガノトトスの評価を下げるのはやめろ,死刑 求刑 する れる る やつ 人狼 殺 評価 下げる の いい ガノトトス 評価 下げる の やめる
"RT @Akatuki2703: ⚠️【拡散希望】⚠️

トレンドに上がっている、

『死刑求刑』

の関連に、
非常に❌グロテスク❌な画像が
ツイートされています！

耐性のない方はくれぐれも
ご注意を！

自分には拡散力がありません
どうかお願い致します

#拡散希望 #拡…",拡散 希望 トレンド 上がる いる 死刑 求刑 関連 非常だ グロ テスク な 画像 ツイート する れる いる ます 耐性 ない 方 注意 自分 拡散 力 ある ます 願う 致す ます 拡散 希望 拡
トレンドの死刑求刑って気になったから検索したらグロ画像出てきた無理吐く無理無理無理,トレンド 死刑 求刑 気 なる 検索 する グロだ 画像 出る くる 無理 吐く 無理 無理 無理
"うわぁ死刑求刑のトレンド見てたらグロ画像見ちゃった…
まだ具合悪い…",うわる 死刑 求刑 トレンド 見る る グロい 画像 見る う 具合 悪い
"死刑求刑って何のニュースかなって開いたらクソグロ画像1番上に出てきてトラウマになりそうなレベル
とりあえず通報した。。。",死刑 求刑 ニュース 開く 画す 像 1 番 上 出る る い る トラ ウマ り す うむ レベル り ある え 通 報 たい
"頼むから皆ﾜﾝﾁｬﾝﾈｺﾁｬﾝﾄｶｹﾞﾁｬﾝの可愛い画像貼って！！！！！！投稿して！！！！！！！！グロ画像あげてる人いたから見た人の心を癒して！！！！！！！
# 死刑求刑",頼む 可愛い 画像 貼る 投稿 する グロだ 画像 あげる る 人 いる 見る 人 心 癒す 死刑 求刑
RT @nagame78678: @tanigaw41463555 トレンドから死刑求刑をなんとなく見たらいきなりこれが出てちょっとビビった,トレンド 死刑 求刑 見る 出る ビビる
トレンドの死刑求刑見てたらタグと関係ないグロと捉えられてもおかしくない画像出てきた…,トレンド 死刑 求刑 見る る タグ 関係 ない グロだ 捉える られる おかしい ない 画像 出る くる
"ただ感情論だけで死刑求刑する外野はナンセンス
一時の感情が人一人を殺人犯にすることと、大衆の感情が人一人を死刑に追いやること　一体何が違うのって話",感情 論 死刑 求刑 する 外野 ナンセンスだ 一 時 感情 人 一 人 殺人 犯 する こと 大衆 感情 人 一 人 死刑 追いやる こと 何 違う の 話
"壇蜜さんとメイプル超合金の安藤さんの結婚の間に突如現れた、死刑求刑。

仮にオセロであったとしてもひっくり返せないレベルの文字列におじさんビックリだよ。 https://t.co/53GZcYxgaK",壇 蜜 さん メイプル 合金 安藤 さん 結婚 間 現れる 死刑 求刑 オセロ する ひっくり返す ない レベル 文字 列 おじさん ビックリ
@HowlDaily 我が県の事件！求刑は死刑ですが、１２月４日の判決ではどうなるか？求刑より判決では刑が軽く成るのが、日本の法律だが、,県 事件 求刑 死刑 １２ 月 ４ 日 判決 なる 求刑 判決 刑 軽い 成る の 日本 法律
"新潟女児殺害、被告に死刑求刑「まれにみる非道な犯行」（朝日新聞） - goo ニュース 

当たり前❗こんな極悪非道な輩は即極刑！極刑にする事で少しでもこんな事件が無くなる抑止力になる事を期待するよ。
 https://t.co/R4LGjkqIqs",新潟 女児 殺害 被告 死刑 求刑 まれだ みる 非道だ 犯行 朝日新聞 ニュース 当たり前だ こん 極悪 非道だ な 極刑 極刑 する 事 事件 無くなる 抑止 力 なる 事 期待 する
トレンドに死刑求刑ってあったから何事かと思って見てみたら概ねみんな真面目に話してる中に本物か作り物かわからんけどグロ画像(女の子の生首の写真)載せてる奴がいて本当神経疑うわと思った,トレンド 死刑 求刑 ある 何事 思う 見る みる 真面目だ 話す る 中 本物 作る 物 わかる グロだ 画像 女の子 生首 写真 載せ てる 奴 いる 本当だ 神経 疑う 思う
"死刑は妥当だと思う。
ただ、こういう事件があるたび「人間性が壊滅的に歪んでしまうぐらい不遇な人生だったのだろうな」と考えてしまう。

新潟女児殺害、被告に死刑求刑「まれにみる非道な犯行」
https://t.co/7ZMJsFgheF",死刑 妥当だ 思う 事件 ある たび 人間 性 壊滅 的だ 歪む しまう ぐらい 不遇だ 人生 考える しまう 新潟 女児 殺害 被告 死刑 求刑 まれだ みる 非道だ 犯行
"RT @hama_nico: 死刑求刑のトレンドでグロ画像上がっててびびったわ
まあフェイク画像だろうけど",死刑 求刑 トレンド グロだ 画像 上がる る びびる フェイク 画像
RT @goripudoru: 適当にトレンド見てたらちょっとエグいツイ画像があったからちょとビビった。｢死刑求刑｣で検索する人へ気をつけて,適当だ トレンド 見る る エグい ツイ 画す 像 ある う たい ら ちょ ビビる う たい 死 刑 求 刑 検索 る 人 気 つ け る
死刑求刑トレンド入りしてるけど無期懲役？になって死ぬまでずっと刑務所で生活するくらいならさっさと殺してくれた方が楽じゃんと思うのですが(笑),死刑 求刑 トレンド 入り する る 無期 懲役 なる 死ぬ 刑務所 生活 する くらい 殺す くれる 方 楽だ 思う 笑
"RT @rin_yo_0000: 恐ろしい世の中だな
会ったこともない知らない人の死を望んでる人が何万人もいるのか
やったことがクソというのには完全に同意だけど死刑求刑はほぼ何も知らない第三者が軽々しく口に出していい事じゃない",恐 ろ しい 世の中 会う こと ない 知る ない 人 死 望む る 人 何万 人 いる やる こと いう 完全だ 同意 死刑 求刑 知る ない 第三者 軽々しい 口 出す いい 事 ない
"死刑求刑に文句いうなら
司法試験受かって当事者になるか政治家になって死刑廃止法案出せばええんちゃう？",死刑 求刑 文句 いう 司法 試験 受かる 当事 者 なる 政治 家 なる 死刑 廃止 法案 出す ええん ちゃう
"死刑求刑か…妥当だよね。
自分の子供があんな目に遭ったら……もし死刑にならないなら復讐しにいくと思う
とりあえず新潟市こわ",死刑 求刑 妥当だ 自分 子供 目 遭う 死刑 なる ない 復讐 する いく 思う 新潟 市 こう
"@albino_usagi_00 トレンド入りしてる
死刑求刑ってやつ？のせいだと思うんだけど
グロいケーキの画像が流れてきてさ…（）
生首の…",トレンド 入り する る 死刑 求刑 やつ せい 思う グロい ケーキ 画像 流れる くる （） 生首
"新潟女児殺害、被告に死刑求刑「まれにみる非道な犯行」（朝日新聞デジタル） https://t.co/SOl7R4Tfgv 
死刑で当然だ！",新潟 女児 殺害 被告 死刑 求刑 まれだ みる 非道だ 犯行 朝日新聞 デジタル 死刑 当然だ
"新潟女児殺害、被告に死刑求刑「まれにみる非道な犯行」
https://t.co/3MNI0oqbCe

遺体を線路に置いた奴な。求刑通りに逝って欲しいわ",新潟 女児 殺害 被告 死刑 求刑 まれだ みる 非道だ 犯行 遺体 線路 置く 奴 求刑 通り 逝く 欲しい
"今トレンドになってる死刑求刑、絶対検索しない方がいいヨ‼️‼️
めっちゃグロいの出てくる🤢

なんのことだろうと思って見てたらなんか検索しない方が良いよって言ってる人いて、それのすぐ下くらいにほんとに気持ち悪いの出てきたから直視は避けられたけど…(｡× ×｡)
作り物？だけどほんとに注意🚨⚡",トレンド なる る 死刑 求刑 検索 しない 方 がいい めっちゃ グロだ いのる 出る くるむ ろうと 思う 見る たらる なんか 検索 しない 方 良い よる 言う てる 人 いる そる れの 下 ほんとだ 気持ち 悪い 出る くる 直視 避ける られる 作り 物 ほんとだ 注意
“女児殺害、線路に遺棄”は殺意明らか・・・死刑求刑(19/11/22) - ANNnewsCH/YouTube(11/22 18:07) https://t.co/quDrChcXqR 新潟市で女児が殺害された事件の…被告(25)に死刑を…被告は去年5月、新潟市で女子児…,女児 殺害 線路 遺棄 殺意 明らかだ 死刑 求刑 19 11 22 11 2218 07 新潟 市 女児 殺害 する れる 事件 被告 25 死刑 被告 去年 5 月 新潟 市 女子 児
ＪＣＣテレビすべて｜新潟・小学２年生女児殺害事件・被告に死刑を求刑 NHK総合【ニュース・気象情報】｜去年５月、新潟市で小学２年生の女児を殺害し線路に遺体を遺棄したとして殺人な... https://t.co/Wy12E2LXBp,ＪＣＣ テレビ 新潟 小学 ２ 年生 女児 殺害 事件 被告 死刑 求刑 総合 ニュース 気象 情報 去年 ５ 月 新潟 市 小学 ２ 年生 女児 殺害 する 線路 遺体 遺棄 する する 殺人
新潟女児殺害、被告に死刑求刑「まれにみる非道な犯行」 https://t.co/b8shVgDIFs　当然の判決だ！遺族の感情を考えたらなおさらだ！,新潟 女児 殺害 被告 死刑 求刑 まれだ みる 非道だ 犯行 当然だ 判決 遺族 感情 考える
死刑に色々文句言うのは犯人側でしょ？犯人がやったことは例え１人でも残虐行為なのだから、今後の事を考えたら死刑にするのが犯罪者を増やさない意味で適当だと思う#死刑求刑,死刑 文句 言う の 犯人 側 犯人 やる こと 例える １ 人 残虐だ 行為 今後 事 考える 死刑 する の 犯罪 者 増やす ない 意味 適当だ 思う 死刑 求刑
"RT @livedoornews: 1000RT：【新潟女児殺害】「まれに見る悪逆非道な犯行」被告に死刑求刑
https://t.co/yhGhE4THEu

起訴状によると、連れ去った女児にわいせつな行為をし、首を絞めて殺害。遺体を線路上に遺棄して列車にはねさせたとされる。…",1000 新潟 女児 殺害 まれだ 見る 悪逆 非道だ 犯行 被告 死刑 求刑 起訴 状 よる 連れる 去る 女児 わいせつだ 行為 する 首 絞める 殺害 遺体 線路 上 遺棄 する 列車 はねる させる する れる
新潟女児殺害　被告に死刑求刑｜BIGLOBEニュース https://t.co/5ORmufBSD8そんじゃよー高級国民の事故でも死刑判決出てもいんじゃねーのか！,新潟 女児 殺害 被告 死刑 求刑 ニュース
