text,wakati_text
"RT @debutonakai: でも一審は裁判員制度だから死刑でも高裁でひっくり返って無期懲役だと思います💢裁判員制度なんて無意味💢

新潟女児殺害 被告に死刑求刑 - Yahoo!ニュース https://t.co/eGl7bqVjIL",一 審 裁判 員 制度 死刑 高裁 ひっくり返る 無期 懲役 思う ます 判 員 制度 無意味だ 潟 女児 殺害 被告 死刑 求刑 ニュース
飯塚に死刑求刑するのってどうやったらできるのかな…？書面を集めるとか？死刑とは行かなくても、あいつ逮捕すらされないらしいんでしょ？そんなの納得いかないから絶対になんかしらの処罰を与えたい。そういうときって何が出来るのかなあ,飯塚 死刑 求刑 する の やる できる 書面 集める 死刑 行く ない あいつ 逮捕 する れる ない の 納得 いく ない なん かしら 処罰 与える たい とき 何 出来る
"死刑求刑がトレンドに入ってるんだけど死刑にならない可能性もあるらしいじゃん
ずっと前から思ってたんだけど万引きとかレイプとかキセルとかとか諸々その辺のありふれた犯罪も全部死刑にすればええやんってずっと前から思ってたけどなんでなんないんや
万引きで焼殺される国もあるのにゆるすぎやろ",死刑 求刑 トレンド 入る る 死刑 なる ない 可能だ 性 ある 前 思う る 万引き レイプ キセル 諸々 その辺 ある ふれる 犯罪 死刑 する いい やん 前 思う る なん ない 万引き 焼殺す れる 国 ある ゆるい すぎる
"RT @OV8JiZncYXJApDT: @nhk_shutoken #池袋母子死亡事故 犯人の
#飯塚幸三 にも是非死刑求刑してください
去年５月、新潟市で小学２年生の女の子を殺害し、線路に遺体を遺棄した小林遼被告（２５）の裁判員裁判が新潟地方裁判所で開かれ、検察は被告に死刑…",犯人 飯塚 幸三 死刑 求刑 する くださる 去年 ５ 月 新潟 市 小学 ２ 年生 女の子 殺害 する 線路 遺体 遺棄 する 小林 遼 被告 ２５ 裁判 員 裁判 新潟 地方 裁判 所 開く れる 検察 被告 死刑
新潟女児殺害、被告に死刑求刑「まれにみる非道な犯行」 (朝日新聞デジタル) - LINE NEWS https://t.co/UrdhdJtMWz #linenews @news_line_meより,新潟 女児 殺害 被告 死刑 求刑 まれだ みる 非道だ 犯行 朝日 新聞 デジタル
新潟女児殺害 被告に死刑求刑 https://t.co/8udbKqFgta,新潟 女児 殺害 被告 死刑 求刑
"死刑求刑がトレンドに入っていたけど、どうせ死刑にならないと思う、再審請求ってしてくるし。
治験の実験体にしたら良いんじゃないか？
臓器提供だとその人間の臓器がこの世に残るんだし。確かに助かる人もいるけど。
それならば、その病を無くせる薬を作った方が役に立つでしょ。",死刑 求刑 トレンド 入る いる 死刑 なる ない 思う 再審 請求 する くるしい 治験 実験 体 する 良い ない 臓器 提供 人間 臓器 この世 残る 確かだ 助かる 人 いる 病 無くせる 薬 作る 方 役 立つ
トレンドに死刑求刑があったのでどれどれ～！？ってタグ飛んだんですけど、どうやらグロ画像貼ってる輩がいるらしいのでフォロワー気をつけてね フォロワーでなくてもグロいの苦手な方は気をつけてね,トレンド 死刑 求刑 ある タグ 飛ぶ グロい 画像 貼る てる いる フォロワー 気 つける フォロワー ない グロい 苦手だ 方 気 つける
1人殺したくらいでとか見るけど、人を殺してる時点でやばいよね。命の価値とか、人を殺してる人間と比べるとねぇ。人殺して何年後かに普通に暮らしてる人と殺されてもう過ごせない人がいる世の中だからな。でも死刑求刑のトレンドでめっちゃ法律に自分詳しいですアピールしてるオタクさん見るの好き笑,1 人 殺す くらい 見る 人 殺す る 時点 やばい 命 価値 人 殺す る 人間 比べる 人 殺す 何 年 後 普通だ 暮らす る 人 殺す れる 過ごせる ない 人 いる 世の中 死刑 求刑 トレンド 法律 自分 詳しい アピール する る オタク さん 見る 好きだ 笑
"死刑求刑はまぁ話聞く限りだと当然だわな

他人の命奪っておいて生き延びるとか都合が良過ぎる

それにこの事件は狂ってるとしか思えないわ",死刑 求刑 話 聞く 限り 当然だ わな 他人 命 奪う おく 生き延びる 良い 過ぎる 事件 狂う る 思える ない
"RT @beautiful_mofu: 新潟女児殺害、被告に死刑求刑「まれにみる非道な犯行」：朝日新聞デジタル https://t.co/N5sxR3lN41

求刑どおりの判決を
それが、一新潟市民としての願い
#新潟女児殺害事件 
#小林遼",求刑 どおり 判決 一 新潟 市民 する 願い 新潟 女児 殺害 事件 小林 遼
死刑求刑がトレンドになってるけどグロ画像苦手な人は見ない方がいい...いたずら（？）で血が出た生首の写真載せてる人おった,死刑 求刑 トレンド なる る グロだ 画像 苦手だ 人 見る ない 方 いい いたずら 血 出る 生首 写真 載せる る 人 おる
"RT @yamachin_nu: 新潟女児殺害、被告に死刑求刑「まれにみる非道な犯行」https://t.co/cQkyexOZpV

裁判員裁判で死刑求刑なのか。
メモ。",新潟 女児 殺害 被告 死刑 求刑 まれだ みる 非道だ 犯行 裁判 員 裁判 死刑 求刑 メモ
新潟女児殺害、被告に死刑求刑「まれにみる非道な犯行」 (朝日新聞デジタル) - LINE NEWS https://t.co/r2gt4hzbcm #linenews @news_line_meから,新潟 女児 殺害 被告 死刑 求刑 まれだ みる 非道だ 犯行 朝日 新聞 デジタル
@tanigaw41463555 トレンドから死刑求刑をなんとなく見たらいきなりこれが出てちょっとビビった,トレンド 死刑 求刑 見る 出る ビビる
RT @l57997778: @y14gfKPzOG5Fda5 どうせ死刑求刑しなかったらしないで批判するくせに,どう せ 死刑 求刑 する ない 批判 する くせ
被害者家族が思うのならわかるけども、赤の他人が死刑求刑すんのはそれはもうただの人殺しと同じじゃないの？だって関係ないんだもん,被害 者 家族 思う わかる 赤 他人 死刑 求刑 する の 人殺し 同じだ ない の 関係 ない もん
死刑求刑云々の話がトレンド入りしている。その上でのそれより、うちの猫見て〜的なツイートは思考停止以外の何者でもない。,死刑 求刑 云々 話 トレンド 入り する いる 上 うち 猫 見る 的だ ツイート 思考 停止 以外 何者 ない
"死刑求刑がトレンドに入ってるけど、死刑を残すなら死刑執行人の臓器提供も考えてもいいのかなって思う。日本で臓器の移植を希望して待機してる人は、およそ14,000人。それに対して移植を受けれる人は年間およそ400人。臓器提供で助かる人を増やしたい",死刑 求刑 トレンド 入る る 死刑 残す 死刑 執行 人 臓器 提供 考える いい なる 思う 日本 臓器 移植 希望 する 待機 する る 人 14 000 人 対する 移植 受ける れる 人 年間 400 人 臓器 提供 助かる 人 増やす たい
"トレンドに死刑求刑ってあって、
飯塚がついに、って思ったけど違った。",トレンド 死刑 求刑 ある 飯塚 思う 違う
死刑求刑か 当たり前だな,死刑 求刑 当たり前だ
死刑求刑ってトレンド押した瞬間グロ画像出てきた,死刑 求刑 トレンド 押す 瞬間 グロ 画像 出る くる
新潟女児殺害、被告に死刑求刑「まれにみる非道な犯行」 https://t.co/cG8ZUEMQU3 #スマートニュース,新潟 女児 殺害 被告 死刑 求刑 まれだ みる 非道だ 犯行 スマートだ ニュース
"最悪
トレンドに死刑求刑ってあったから見てたら、生首の画像のせてる人いた、、",最悪だ トレンド 死刑 求刑 ある 見る る 生首 画像 せる る 人 いる
"RT @hiropyon_001: 裁判官は前例にとらわれずしっかりと死刑にしてほしい。
新潟女児殺害 被告に死刑求刑 （朝日新聞デジタル） - auヘッドライン - auサービスTOP https://t.co/hNChOwvjit #auサービスTOP",裁判 官 前例 とらわれる 死刑 する ほしい 新潟 女児 殺害 被告 死刑 求刑 朝日新聞 デジタル ヘッド ライン サービス サービス
"死刑制度に反対の人もいるが、個人的には死刑以上の刑罰さえ必要と感じている
勿論、倫理的な問題があるのは重々承知だが、極悪非道な連中には死刑すら生温い、そう思う
「新潟女児殺害、被告に死刑求刑「まれにみる非道な犯行」」https://t.co/2db1iG9sr5",死刑 制度 反対だ 人 いる 個人 的だ 死刑 以上 刑罰 必要だ 感じる いる 倫理 的だ 問題 ある の 承知 極悪 非道だ 連中 死刑 生温い 思う 新潟 女児 殺害 被告 死刑 求刑 まれだ みる 非道だ 犯行
RT @nhk_news: 新潟女児殺害 被告に死刑求刑 #nhk_news https://t.co/YSvcW7BPNs,
永山基準において特に残虐性が突出したチャートになる事件なんだけど、酷いのは情状においても全く酌量の余地がないほどに身勝手。死刑求刑は当然か。,永山 基準 おく 残虐だ 性 突出 する チャート なる 事件 酷い の 情状 おく 酌量 余地 ない ほど 身勝手だ 死刑 求刑 当然だ
RT @LuraPix3: 日本政府にGSOMIAの条件付き延長が伝えられた事を受け、檀蜜が韓国政府の死刑を求刑（トレンド）,日本 政府 条件 付き 延長 伝える られる 事 受ける 檀蜜 韓国 政府 死刑 求刑 トレンド
わいせつ目的で連れ去って、事に及んだ後に首絞めて殺して死体を線路に置いて電車に潰させるって、そら検察も死刑求刑するわな。これを弁護する弁護士も大変だわ。,わいせつだ 目的 連れる 去る 事 及ぶ 後 首 絞める 殺す 死体 線路 置く 電車 潰す せる そる 検察 死刑 求刑 する 弁護 する 弁護 士 大変だ
"トレンドに死刑求刑ってのが入ってるって…

怖すぎるんだが。",トレンド 死刑 求刑 入る る 怖い すぎる
"新潟女児殺害 被告に死刑求刑 - Yahoo!ニュース: https://t.co/aMOa2auxcf
あー、被害１人だけど全部認められたら死刑なるかなぁ",新潟 女児 殺害 被告 死刑 求刑 ニュース ある 被害 １ 人 認める られる 死刑 なる
"弁護士も絶対引き受けたくなかったと思うよ、横山弁護士が頭によぎる
新潟女児殺害、被告に死刑求刑「まれにみる非道な犯行」：朝日新聞デジタル https://t.co/yPfel4fwB9",弁護 士 引き受ける たい ない 思う 横山 弁護 士 頭 よぎる 新潟 女児 殺害 被告 死刑 求刑 まれだ みる 非道だ 犯行 朝日新聞 デジタル
いま死刑求刑の文字を見た。怖い。私の味方さん、必ずサトラレだと教えてくださいなんですが、味方さん、いますでしょうか？どなたか知らないんです。,いま 死刑 求刑 文字 見る 怖い 私 味方 さん サトラレ 教える くださる 味方 さん いる ます どなた 知る ない
死刑求刑トレンドでどんな事件が死刑判決になったのか見ようと思ったら生首ケーキなんて出てきてマジで画面叩き割るところだった　トレンドに便乗して気持ち悪いツイート伸ばそうとしてるのか？頭湧いてんだろ,死刑 求刑 トレンド 事件 死刑 判決 なる 見る 思う 生首 ケーキ 出る くる マジだ 画面 叩く 割る ところ トレンド 便乗 する 気持ち 悪い ツイート 伸ばす する る 頭 湧く
死刑求刑のタグでグロ画像踏んじゃった、、きもすぎてはく、、,死刑 求刑 タグ グロだ 画像 踏む う きも すぎる はく
"グロいの苦手な人は死刑求刑ってやつ調べないほうがいいよ。
生首の画像出てきたから",グロい 苦手だ 人 死刑 求刑 やつ 調べる ない ほう いい 生首 画像 出る くる
"当然だ。女児をいたぶり殺したような奴に生きる資格は無い。
/
新潟女児殺害 被告の男に死刑求刑    https://t.co/rloP0k4Th7",当然だ 女児 いたい ぶり 殺す 奴 生きる 資格 無い 新潟 女児 殺害 被告 男 死刑 求刑
RT @imk0515bs: 死刑求刑するより真冬の北海道の雪かきや真夏の関東のタダ働きのほうが国のためにもなると思うで、ワイは（鼻ほじ）（知らんけど）,死刑 求刑 する 冬 北海道 雪かき 真夏 関東 働き ほう 国 ため なる 思う ワイ 鼻 ほじ 知る
新潟の女児誘拐殺人事件で死刑求刑がトレンド入りしていますね,新潟 女児 誘拐 殺人 事件 死刑 求刑 トレンド 入り する いる ます
"死刑求刑がトレンド入りしてた
けど賛成か否かと言われたら
賛成だ。もしくは同じ目に合わせたいって思うよ。時には赤の他人の事件
でさえ思う。そうじゃなけれぼ
冷暖房の無い所でご飯も最低限しか
与えず交流もなく一生を終えて貰いたい。非人道的？知らん。",死刑 求刑 トレンド 入り する る 賛成 否 言う れる 賛成 同じだ 目 合わせる たい 思う 時 赤 他人 事件 思う ない ける ぼ 冷暖房 無い 所 ご飯 最低だ 限 与える 交流 ない 一生 終える 貰う たい 人道 的だ 知る
"トレンドの「死刑求刑」、タップしたらトップツイートにグロ写真あるから気をつけて！！
グロがダメな人はトラウマレベルだと思うよ！",トレンド 死刑 求刑 タップ する トップ ツイート グロだ 写真 ある 気 つける グロだ ダメだ 人 思う
【前田恒彦さんのコメント】「あなたにできる最低限の償いは真実を述べることだと思いますが、真実を述べないこ... ▼新潟女児殺害、被告に死刑求刑「まれにみる非道な犯行」 https://t.co/Qn3cwFq8lr,前田 恒彦 さん コメント あなた できる 最低だ 限 償い 真実だ 述べる 思う ます 真実だ 述べる ない 新潟 女児 殺害 被告 死刑 求刑 まれだ みる 非道だ 犯行
死刑求刑のタグ見たら生首の写真載せてアップしてた奴がいたので苦手な方はご注意ください,死刑 求刑 タグ 見る 生首 写真 載せる アップ する る 奴 いる 苦手だ 方 注意 くださる
死刑求刑って飯塚幸三のことかと思ったら違った,死刑 求刑 飯塚 幸三 こと 思う 違う
"死刑求刑ってトレンドに入ってて何事や？と思ったら、まぁそういう事件だなと
死刑じゃ足りない、と言うけれど、じゃぁどんな刑にすればいいんだよ
って話

まぁ簡単な話、死刑囚でも最低限の人権が与えられてるので、その最低限を剥奪する刑があれば死刑以上だと思うのです
これ以上は察して",死刑 求刑 トレンド 入る る 何事 思う 事件 死刑 足りる ない 言う 刑 する いい 話 簡単だ 話 死刑 囚 最低だ 限 人権 与える られる る 最低だ 限 剥奪 する 刑 ある 死刑 以上 思う 以上 察する
"は？もうクソなんだが
トレンドの死刑求刑押したら話題のツイートで生首の画像出てきた。秒でブロックしたけど最悪。殺す。",は？ トレンド 死刑 求刑 押す 話題 ツイート 生首 画像 出る くる 秒 ブロック する 最悪だ 殺す
死刑求刑タグ使って関係ない画像貼るなゴミ,死刑 求刑 タグ 使う 関係 ない 画像 貼る ない ゴミ
死刑求刑がトレンド入りと見てなんのことだろうと思ってクリックしてみたが「なんで死刑に反対するかわからないからご意見教えてくれませんか」と言ってすごい真摯に反対意見を求めてる人がいて感動した。まだ世は捨てたもんじゃないなとまで思った,死刑 求刑 トレンド 入り 見る こと 思う クリック する みる 死刑 反対 する わかる ない 意見 教える くれる ます 言う すごい 真摯だ 反対 意見 求める る 人 いる 感動 する 世 捨てる もん ない 思う
死刑求刑のトレンド開いた瞬間生首のグロ画像出てきて心停止した ケーキなんこれ…,死刑 求刑 トレンド 開く 瞬間 生首 グロ 画像 出る くる 心 停止 する ケーキ なん
死刑求刑みたいなトレンド眺めたって面白くもないことはわかりきってるので、俺は華麗に避けた！　シュッ！,死刑 求刑 トレンド 眺める 面白い ない こと わかる きる る 俺 華麗だ 避ける シュッ
"求刑死刑の方は特に死刑を回避するに足る理由が無いのでまあ死刑でしょうよ
世の中には理屈では説明のつかない極悪非道サイコパスがいるのだと",求刑 死刑 方 死刑 回避 する 足る 理由 無い 死刑 世の中 理屈 説明 つく ない 極悪 非道だ サイコパス いる
死刑求刑…池袋のやつかと思ったけど違った。でも罪状何が違うのかな。同じ人殺しなのにね。,死刑 求刑 池袋 やつ 思う 違う 罪状 何 違う 同じだ 人殺し
２５歳男に死刑求刑　女児殺害公判、「悪逆非道」と検察―新潟地裁：時事ドットコム https://t.co/B1GWC2lb8h @jijicomから,２５ 歳 男 死刑 求刑 女児 殺害 公判 悪逆 非道だ 検察 新潟 地裁 時事 ドットコム
新潟女児殺害、被告に死刑求刑「まれにみる非道な犯行」（朝日新聞デジタル）。φ(･ω･｀),新潟 女児 殺害 被告 死刑 求刑 まれだ みる 非道だ 犯行 朝日新聞 デジタル
"こんなクソ野郎は明日死刑にしろ！
明日じゃあ勿体ないか。
この上ない恐怖を与えるやり方で死刑にしろ！

新潟女児殺害、被告に死刑求刑「まれにみる非道な犯行」 #ldnews https://t.co/vPxz1AwQ5G",クソ 野郎 明日 死刑 する 明日 勿体 ない ない 恐怖 与える やり 方 死刑 する 新潟 女児 殺害 被告 死刑 求刑 まれだ みる 非道だ 犯行
【新潟女児殺害事件】被告の小林遼に死刑を求刑 顔は？当時の事件の報道などを振り返る #新潟女児殺害 #小林遼 https://t.co/XI6t4nwvvN,新潟 女児 殺害 事件 被告 小林 遼 死刑 求刑 顔 当時 事件 報道 振り返る 新潟 女児 殺害 小林 遼
"死刑求刑がトレンド入り
死刑には賛否あると思うが、人間社会の安全を守るために人を殺す人外(人害)を排除するというのは当然のことだと思う
不法不正義に人を殺す人間は、人ではなくただの害獣なんだから",死刑 求刑 トレンド 入り 死刑 賛否 ある 思う 人間 社会 安全だ 守る ため 人 殺す 人 外 人 害 排除 する いう の 当然だ こと 思う 不法だ 正義 人 殺す 人間 人 ない 害獣
"女児の死亡前にわいせつ行為はなかったとして、強制わいせつ致死罪も成立しないなどと訴えている。
新潟女児殺害、被告に死刑求刑「まれにみる非道な犯行」 (朝日新聞デジタル) https://t.co/ogBn77ZHFr #linenews",女児 死亡 前 わいせつだ 行為 ない する 強制 わいせつだ 致死 罪 成立 する ない 訴える いる 新潟 女児 殺害 被告 死刑 求刑 まれだ みる 非道だ 犯行 朝日 新聞 デジタル
"死刑求刑トレンド入りしてて見てみたら気持ち悪い画像出てきて気分悪くなった。
そういうことする人本気で何考えてるかわかんない。",死刑 求刑 トレンド 入り する る 見る みる 気持ち 悪い 画像 出る くる 気分 悪い なる こと する 人 本気だ 何 考える る わかんない
"RT @kakerupc: 死刑は妥当だと思う。
ただ、こういう事件があるたび「人間性が壊滅的に歪んでしまうぐらい不遇な人生だったのだろうな」と考えてしまう。

新潟女児殺害、被告に死刑求刑「まれにみる非道な犯行」
https://t.co/7ZMJsFgheF",死刑 妥当だ 思う 事件 ある たび 人間 性 壊滅 的だ 歪む しまう 不遇だ 人生 考える しまう 新潟 女児 殺害 被告 死刑 求刑 まれだ みる 非道だ 犯行
死刑求刑がトレンド入ってんだけど、俺が大切な人を殺されたら死にたくても死ねない(飯を与えられないとかの)環境に死ぬまで犯人を閉じ込めてほしいと思う,死刑 求刑 トレンド 入る 俺 大切だ 人 殺す れる 死ぬ たい 死ぬ ない 飯 与える られる ない 環境 死ぬ 犯人 閉じる 込める ほしい 思う
"@disney423 忠告すればよかったごめん🙇‍♀️
ケーキとは言え、死刑求刑と全く関係ない画像を上げるなって感じ",忠告 する よい ごめん ケーキ 言える 死刑 求刑 関係 ない 画像 上げる なる 感じ
新潟女児殺害、被告に死刑求刑「まれにみる非道な犯行」（朝日新聞デジタル） - Yahoo!ニュース https://t.co/0wQtFl9HOr,新潟 女児 殺害 被告 死刑 求刑 まれだ みる 非道だ 犯行 朝日新聞 デジタル ニュース
新潟女児殺害、検察側は死刑求刑 25歳男に、判決は12月4日 https://t.co/DfQr5OymyK #NewsDigest,新潟 女児 殺害 検察 側 死刑 求刑 25 歳 男 判決 12 月 4 日
死刑求刑のハッシュタグに自分の家の猫の画像載せてる奴嫌い,死刑 求刑 ハッシュ タグ 自分 家 猫 画像 載せる る 奴 嫌いだ
@FIFI_Egypt この死刑求刑に対して、感情論や人の命を軽く扱うと言う方々＝レイプ目的で車で引かれその後首を絞められ電車でひかれに感情を出さない方々となる＝逆に尊敬するよね？人ならざるモノになったという事だからね？この事件で感情沸かず冷静＝人外かね？,死刑 求刑 対する 感情 論 人 命 軽い 扱う 言う 方々 レイプ 目的 車 引く れる その後 首 絞める られる 電車 ひかる 感情 出す ない なる 逆だ 尊敬 する 人 なる モノ なる いう 事 事件 感情 沸く 冷静だ 人 外
"今死刑求刑されてる人の事件の詳細を読んだ。おぞましい。
性的暴行目的で拐い、暴行、殺害、その後も身体を玩び、証拠隠滅で死体損壊。よくもまぁ。
個人的に嫌だなと思うのは、殺害後の行動の意味をなんとなく想像できてしまう自分がいること。",死刑 求刑 する れる る 人 事件 詳細だ 読む おぞましい 性 的だ 暴行 目的 い 暴行 殺害 その後 身体 玩ぶ 証拠 隠滅 死体 損壊 個人 的だ 嫌だ 思う の 殺害 後 行動 意味 想像 できる しまう 自分 いる こと
"RT @Iris_hjhs_sts: フォロワーよ

今死刑求刑で検索するときは十分気をつけるんや…
騒動に乗じてけしからん奴がグロ画像を貼っている…
ツイートを見るときはゆっくりゆっくりスクロールするのだ…
おじいちゃんとの約束だよ…",フォロワー 死刑 求刑 検索 する とき 十分だ 気 つける 騒動 乗ずる 奴 グロい 画像 貼る いる ツイート 見る とき する おじい ちゃん 約束
"死刑は当然。問題は執行です。衣食住が保証されていて労働も免除されている、そんな執行待ちの死刑囚が多すぎるの、おかしくないですか？

新潟女児殺害 被告に死刑求刑 2019年11月22日 https://t.co/gjldcKyZGR",死刑 当然だ 問題 執行 衣食住 保証 する れる いる 労働 免除 する れる いる 執行 待ち 死刑 囚 多い すぎる おかしい ない 新潟 女児 殺害 被告 死刑 求刑 2019 年 11 月 22 日
"🌙夕刊
■主なニュース
・新潟女児殺害 被告に死刑求刑
・香港デモ 12歳男児に有罪判決
・安藤なつ 一般男性と結婚

https://t.co/Vg7ffEexkQ",夕刊 主だ ニュース 新潟 女児 殺害 被告 死刑 求刑 香港 デモ 12 歳 男児 有罪 判決 安藤 なつ 一般 男性 結婚
【動画】“女児殺害、線路に遺棄”は殺意明らか・・・死刑求刑(19/11/22) https://t.co/vhG31hmg7F,動画 女児 殺害 線路 遺棄 殺意 明らかだ 死刑 求刑 19 11 22
"@niigata_nippo 求刑は死刑しかないだろ
当然、死刑にしろ！って思うわ

問題は判決がどうかだよ。
死刑であって欲しい。",求刑 死刑 ない 死刑 する 思う わ 問題 判決 死刑 欲しい
