text,wakati_text
"新潟女児殺害、検察側は死刑求刑 :　新潟市西区で昨年5月、小学2年の女児＝当時(7)＝が下校中に連れ去られて殺害された事件で、殺人や強制わいせつ致死などの罪に問われた被告(25)の裁判員裁判の論告求刑公判が22日、新潟地裁であり、検察側は死刑を求刑した。判決は12月4日。
https://t.co/Mo5tXwdVYG",新潟 女児 殺害 検察 側 死刑 求刑 新潟 市 西 区 昨年 5 月 小学 2 年 女児 当時 7 下校 中 連れる 去る れる 殺害 する れる 事件 殺人 強制 わいせつだ 致死 罪 問う れる 被告 25 裁判 員 裁判 論告 求刑 公判 22 日 新潟 地裁 検察 側 死刑 求刑 する 判決 12 月 4 日
"レイプして殺害して遺体を線路に置くとか正気の沙汰とは思えん
死刑求刑なのは納得だわ",レイプ する 殺害 する 遺体 線路 置く 正気だ 沙汰 思える 死刑 求刑 の 納得
新潟の事件、死刑求刑か。自分に置き換えると本当に辛くなる。,新潟 事件 死刑 求刑 自分 置く 換える 本当だ 辛い なる
"新潟の女児殺害事件の犯人死刑求刑か

そりゃそーだろーな 当然

25で死刑か
何のために生まれてきたんだろうね

しかも僕と同じ地元&amp;同い年だし
最悪",新潟 女児 殺害 事件 犯人 死刑 求刑 ない 当然だ 25 死刑 ため 生まれる くる 僕 同じだ 地元 同い年 だし 最悪だ
新潟女児殺害、被告に死刑求刑「まれにみる非道な犯行」（朝日新聞デジタル） - Y!ニュース https://t.co/2kTcOU4qQF,新潟 女児 殺害 被告 死刑 求刑 まれだ みる 非道だ 犯行 朝日新聞 デジタル ニュース
"死刑でも足りないくらい。
大切や我が子を怪我された上に奪われて。

新潟女児殺害、被告に死刑求刑「まれにみる非道な犯行」（朝日新聞デジタル） https://t.co/H7ltUd9zyn",死刑 足りる ない くらい 大切だ 子 怪我 する れる 上 奪う れる 新潟 女児 殺害 被告 死刑 求刑 まれだ みる 非道だ 犯行 朝日新聞 デジタル
RT @47news: 新潟女児殺害、25歳男に死刑求刑 https://t.co/pg1ZBYjL2b,
"RT @Yomiuri_Online: 新潟小２女児殺害、被告に死刑求刑…地裁
https://t.co/gaG2ZTTGuj
#社会",新潟 小 ２ 女児 殺害 被告 死刑 求刑 地裁 社会
"な…！？照ノ富士に死刑求刑！？

嗚呼…どうしてそんな事に……（オロオロ）

※混ぜんなYO",照 富士 死刑 求刑 嗚呼 事 混ぜる なる
"かわいそうに…
新潟女児殺害、被告に死刑求刑「まれにみる非道な犯行」https://t.co/U5z3MIJydL",かわいそうだ 新潟 女児 殺害 被告 死刑 求刑 まれだ みる 非道だ 犯行
新潟女児殺害 被告に死刑求刑 https://t.co/HEbPoKZHTN #Yahooニュースアプリ,新潟 女児 殺害 被告 死刑 求刑 ニュース アプリ
小林遥、死刑求刑来たか,小林 遥 死刑 求刑 来る
ほらね死刑求刑とか黒いの乗せて世間の目をそちらに向けようとしてもミエミエやることがバカすぎるわほんと死んだほうがいいんじゃないの?,ね 死刑 求刑 黒い 乗せる 世間 目 向ける する やる こと バカだ すぎる ほんとだ 死ぬ ほう いい ない
"@mainichi 死刑求刑？
あまいっ！",死刑 求刑 あまい いく
新潟小2女児殺害、25歳男に死刑求刑 新潟地裁 https://t.co/eMqQvLUKmS,新潟 小 2 女児 殺害 25 歳 男 死刑 求刑 新潟 地裁
RT @tv_asahi_news: 【速報】新潟市女児殺害事件　小林遼被告に死刑求刑　検察側,速報 新潟 市 女児 殺害 事件 小林 遼 被告 死刑 求刑 検察 側
@FIFI_Egypt この死刑求刑に感情論や関係無い人が死刑とか命を軽く扱うと言う方々がいる＝そういう方々は、自分が理不尽な目に遭った時に感情の泉が無い機械人形の協力のみを求めろと言われるのか？そもそも命が軽く扱われたのは誰であり誰がやったのか？そこが欠けていると思う。,死刑 求刑 感情 論 関係 無い 人 死刑 命 軽い 扱う 言う 方々 いる 方々 自分 理不尽だ 目 遭う 時 感情 泉 無い 機械 人形 協力 求める 言う れる 命 軽い 扱う れる の 誰 誰 やる 欠ける いる 思う
"死刑妥当だと思いますが。

 新潟女児殺害、被告に死刑求刑「まれにみる非道な犯行」 https://t.co/4xenTr1kNO",死刑 妥当だ 思う ます 新潟 女児 殺害 被告 死刑 求刑 まれだ みる 非道だ 犯行
"トレンドに死刑求刑となっちゃん結婚があって
死刑の見たら胸糞悪い事件で犯人の目は完全にサイコパスだし一部の人は死刑囚は臓器提供したらとかいう話にまで発展しててそれいいなぁでも死刑囚の臓器かーなんて考えつつえ！？なっちゃんってあのジュースの？あ、メイプル超合金か！とか脳みそパニック",トレンド 死刑 求刑 なる 結婚 ある 死刑 見る 胸糞 悪い 事件 犯人 目 完全だ サイコパス だし 一部 人 死刑 囚 臓器 提供 する いう 話 発展 する る いい 死刑 囚 臓器 考える え！？ なっちゃん ジュース メイプル 合金 脳みそ パニック
新潟小２女児殺害、被告に死刑求刑…地裁 : 国内 : ニュース : 読売新聞オンライン https://t.co/gaG2ZTC55J,新潟 小 ２ 女児 殺害 被告 死刑 求刑 地裁 国 内 ニュース 読売 新聞 オンライン
"新潟女児殺害、被告に死刑求刑「まれにみる非道な犯行」：朝日新聞デジタル
これを弁護するって考えると弁護士って職業は大変だよな。司法に関わる人は余計な感情論を入れずに刑を決定しなければならない。民衆は感情論で騒ぐから叩き晒し炎上させられたりもするのかな https://t.co/nDG7LuyuOr",新潟 女児 殺害 被告 死刑 求刑 まれだ みる 非道だ 犯行 朝日新聞 デジタル 弁護 する 考える 弁護 士 職業 大変だ 司法 関わる 人 余計だ 感情 論 入れる 刑 決定 する ない なる ない 民衆 感情 論 騒ぐ 叩く 晒す 炎上 する せる られる する
【速報】新潟女児殺害公判　被告に死刑求刑 裁判員制度で新潟地裁初 | 社会 | 新潟県内のニュース | 新潟日報モア https://t.co/bKZxeBvAjU,速報 新潟 女児 殺害 公判 被告 死刑 求刑 裁判 員 制度 新潟 地裁 社会 新潟 県 内 ニュース 新潟 日報 モア
トレンドの死刑求刑って飯塚幸三かと思ったわ https://t.co/CnKJtwW6A2,トレンド 死刑 求刑 飯塚 幸三 思う
"死刑求刑って死んで償えってことでしょ？

怖っ",死刑 求刑 死ぬ 償う こと 怖い う
ぼくは少なくとも死刑求刑レベルのおっさんが何十年か経って娑婆に出てくるのは嫌だし、無期懲役で死ぬまで国民の血税で養われるのも嫌だし、死刑求刑で妥当なら死んでいいんじゃないって思いましたまる,ぼく 死刑 求刑 レベル おっさん 何十 年 経つ 娑婆 出る くる の 嫌だ 無期 懲役 死ぬ 国民 血税 養う れる の 嫌だ 死刑 求刑 妥当だ 死ぬ いい ない 思う ます
新潟女児殺害 被告に死刑求刑 https://t.co/AOm3wBhc92,新潟 女児 殺害 被告 死刑 求刑
"検察を褒めてあげよう！👏
後は「裁判所」だけが今の司法に乗り遅れてるから 「裁判所」がかわってくれる事を切に望むしかない…
結局 被告が死刑を望んでないから「無期」で終わるかな？

新潟女児殺害、被告に死刑求刑「まれにみる非道な犯行」（朝日新聞デジタル） https://t.co/BRgcFnqKeu",検察 褒める あげる 裁判 所 今 司法 乗る 遅れる る 裁判 所 かわる くれる 事 切だ 望む ない 被告 死刑 望む ない 無期 終わる 新潟 女児 殺害 被告 死刑 求刑 まれだ みる 非道だ 犯行 朝日新聞 デジタル
"【新潟女児殺害・裁判員裁判】
検察は、被告に死刑求刑「まれにみる非道な犯行」
⬇
この男は後悔はすれど、反省はしているとは思われない態度。謝罪文などどうとでも言える。故郷新潟を怪我した被告は、社会に帰るべきではないし、帰る場所もないはず。

https://t.co/QZWL8fCzZW",新潟 女児 殺害 裁判 員 裁判 検察 被告 死刑 求刑 まれだ みる 非道だ 犯行 こ 男 後悔 する 反省 する いる 思う れる ない 態度 謝罪 文 言える 故郷 新潟 怪我 する 被告 社会 帰る ない 帰る 場所 ない
RT @mainichijpnews: 新潟・女児殺害　被告に死刑求刑　新潟地裁 https://t.co/WDKT5lH3WV,
RT @nekonana1221: 死刑求刑で出てくる物騒な画像より我が家の猫ちゃんの写真でも見て https://t.co/S55g5v7eh0,
新潟女児殺害、被告に死刑求刑「まれにみる非道な犯行」 https://t.co/0Z0M75w8vl #Yahooニュースアプリ,新潟 女児 殺害 被告 死刑 求刑 まれだ みる 非道だ 犯行 ニュース アプリ
"トレンドの「死刑求刑」をクリックしたらすごくグロテスクな画像が出てきてびっくりした…血の気引いた…

みんなも気をつけて",トレンド 死刑 求刑 クリック する すごい グロテスクだ 画像 出る くる びっくり する 血の気 引く 気 つける
"RT @ToriinaruTorii: 別に死刑に反対しているわけではないんだがこういった話題があがると「死刑にしろ」「犯人を人体実験に使え」「死よりも怖い思いをさせろ」とか簡単にsnsとかで言ってる人が多くてちょっと人って怖いなって思った。
新潟女児殺害、被告に死刑求刑「まれ…",別 死刑 反対 する いる ない 話題 あがる 死刑 する 犯人 人体 実験 使う 死 怖い 思い する せる 簡単だ とか 言う る 人 多い 人 怖い なる 思う 新潟 女児 殺害 被告 死刑 求刑 まれだ
"自分の子供がこんなんされたら絶対気が狂う自信がある

新潟女児殺害、被告に死刑求刑「まれにみる非道な犯行」：朝日新聞デジタル https://t.co/ShtNeuJo6U",自分 子供 こんなんだ する れる 気 狂う 自信 ある 新潟 女児 殺害 被告 死刑 求刑 まれだ みる 非道だ 犯行 朝日新聞 デジタル
"死刑求刑人の臓器提供は、考えてもいいのではないか、

ひとつの意見として、罪を犯した人の臓器は使いたくない。と言った意見はあると思うが、
臓器を移したから罪を犯したのと同意にはならない。なんなら、臓器には罪はないはず。",死刑 求刑 人 臓器 提供 考える いい ない ひと つ 意見 する 罪 犯す 人 臓器 使う たい ない 言う 意見 ある 思う 臓器 移す 罪 犯す の 同意 なる ない 臓器 罪 ない
"新潟の女児殺害の裁判。

検察側も父親も死刑を求刑か。

仇討ち禁止になって、かわりに裁判所つくったんじゃないの？

被告側は治療を望んでいるって話です。",新潟 女児 殺害 裁判 検察 側 父親 死刑 求刑 仇討ち 禁止 なる かわり 裁判 所 つくる ない 被告 側 治療 望む いる 話
"何でも必要性があってするものだが、死刑求刑ともなれば考えるべきリスクは重大
そのリスクとは犯罪者によるものだけではなく、社会に居座りながら責任を放棄し、思い通りに他者を潰す危険な存在のことでもある",必要だ 性 ある する もの 死刑 求刑 なる 考える リスク 重大だ リスク 犯罪 者 よる もの ない 社会 居座る 責任 放棄 する 思い通りだ 他者 潰す 危険だ 存在 こと ある
【新潟女児殺害事件】被告の小林遼に死刑を求刑 顔は？当時の事件の報道などを振り返る : まとめダネ！  #新潟女児殺害 #小林遼 https://t.co/LlINiFjxdm @matomedaneから,新潟 女児 殺害 事件 被告 小林 遼 死刑 求刑 顔 当時 事件 報道 振り返る まとめ ダネ 新潟 女児 殺害 小林 遼
"被告が男だから充分チャンスはある
女だったら死刑は厳しかったろうね

新潟女児殺害、被告に死刑求刑「まれにみる非道な犯行」 #ldnews https://t.co/Pap6BXh7Op",被告 男 充分だ チャンス ある 女 死刑 厳しい 新潟 女児 殺害 被告 死刑 求刑 まれだ みる 非道だ 犯行
"死刑求刑か
そりゃそうだわなぁ
判決がどうなっても控訴するんだろうけど。",死刑 求刑 そる そうだ わな 判決 なる 控訴 する
"新潟女児殺害 被告に死刑求刑 - Yahoo!ニュース

でしょうね https://t.co/RWyOGnVox8",新潟 女児 殺害 被告 死刑 求刑 ニュース
死刑求刑と復讐ってやってることほぼ一緒なのになんで復讐は悪と見なす人が多いのだろうか,死刑 求刑 復讐 やる る くる とほ ぼす 一 緒 復讐 悪 見る 人 多い い る うむ
きょうの論告求刑公判で検察は『まれに見る悪逆非道な犯行で、生命軽視の度合いが甚だしく大きい』と死刑を求刑した。 https://t.co/HWlN4rbkUH,きょう 論告 求刑 公判 検察 まれだ 見る 悪逆 非道だ 犯行 生命 軽視 度合い 甚だしい 大きい 死刑 求刑 する
"和歌山毒物混入カレー事件の件を知ると、こっちは大丈夫なんか❓感が拭えん。。
新潟女児殺害、被告に死刑求刑「まれにみる非道な犯行」 #ldnews https://t.co/hfweyxA4rO",和歌山 毒物 混入 カレー 事件 件 知る 大丈夫だ 感 拭える 新潟 女児 殺害 被告 死刑 求刑 まれだ みる 非道だ 犯行
トレンドの死刑求刑、ふざけたグロ画像に当たるから気を付けた方がいいよ…バーカバーカ…,トレンド 死刑 求刑 ふざける グロだ 画像 当たる 気 付ける 方 いい
RT @Momoru1225: あの！既に見てしまった方もいますけど！フォロワーさん！絶対死刑求刑のトレンド覗かないで！！！グロ画像あっから！！！,見る しまう 方 いる ます フォロワー さん 死刑 求刑 トレンド 覗く グロだ 画像
舐めたこと言ってるから死刑求刑されてんじゃん韓国さん https://t.co/j78Lkflr35,舐める こと 言う る 死刑 求刑 する れる 韓国 さん
"新潟女児殺害 被告に死刑求刑
即刻死刑なんて生易しい😡
殺害された女の子がどれ程怖かった事か。想像するだけでも可哀想でたまらない😭 https://t.co/CrZQBsT4SP",新潟 女児 殺害 被告 死刑 求刑 死刑 生易しい 害 する れる 女の子 程 怖い 事 想像 する 可哀想だ たまる ない
RT @sutekinamiraie: 新潟女児殺害、被告に死刑求刑「まれにみる非道な犯行」：朝日新聞デジタル https://t.co/uaitkowcdC,
死刑求刑トレンドいいね。どんどん死刑にしてくれ,死刑 求刑 トレンド いい 死刑 する くれる
拷問処刑とかまでは思ってなかったけど。死刑求刑された人は人体実験に使うべきだと思ってる。罪のない動物達を実験道具にして殺すより、人のための実験なら人を使うべき。 https://t.co/eXprhKV2o8,拷問 処刑 思う ない 死刑 求刑 する れる 人 人体 実験 使う 思う る 罪 ない 動物 達 実験 道具 する 殺す 人 ため 実験 人 使う
死刑求刑がトレンドにあるけど、ただ死ぬだけじゃ償えないだろ。もっと悲惨にするべき。っていう正しい意見に対して馬鹿にする連中がいるのに驚愕。あんだけ悪いやつを人間として扱う気が知れないわ,死刑 求刑 トレンド ある 死ぬ 償う ない 悲惨だ する いう 正しい 意見 対する 馬鹿だ する 連中 いる の 驚愕 あん 悪い やつ 人間 する 扱う 気 知れる ない
こんな酷い犯罪には死刑以外にはないでしょう。＞新潟女児殺害、被告に死刑求刑「まれにみる非道な犯行」 #SmartNews  https://t.co/0NKheXhBSm,酷い 犯罪 死刑 以外 ない 新潟 女児 殺害 被告 死刑 求刑 まれだ みる 非道だ 犯行
死刑求刑が出ると、必ず殺人は全て死刑と抜かすアホカスが出ますが、例えば悪意と金銭的余裕ある人間が気に入らない対象者を民事不介入を盾に嫌がらせを続け、対象者は鬱に悩まされ、ついに相手を殺害したとしても加害者は死刑と言うのかは気になりますな。まあアホだから考えてないか(笑),死刑 求刑 出る 殺人 死刑 抜かす アホカス 出る ます 悪意 金銭 的だ 余裕 ある 人間 気に入る ない 対象 者 民事 介入 盾 嫌がらせ 続ける 対象 者 鬱 悩む す れる 相手 殺害 する する 加害 者 死刑 言う 気 なる ます アホ 考える ない 笑
新潟女児殺害、被告に死刑求刑「まれにみる非道な犯行」（朝日新聞デジタル） - Yahoo!ニュース: https://t.co/NLEYRXF5jq,新潟 女児 殺害 被告 死刑 求刑 まれだ みる 非道だ 犯行 朝日新聞 デジタル ニュース
“女児殺害、線路に遺棄”は殺意明らか・・・死刑求刑 https://t.co/uvey2A5kcH,女児 殺害 線路 遺棄 殺意 明らかだ 死刑 求刑
"死刑求刑

日本から死刑制度がなくなる日は来るのだろうか‥
世界の200の国で、死刑制度を残しているのは、凡そ1/4。",死刑 求刑 日本 死刑 制度 なくなる 日 来る 世界 200 国 死刑 制度 残す いる の 1
"死刑求刑っていうトレンドみてどうしても言いたい。
死刑反対！死刑制度廃止！",死刑 求刑 いう トレンド みる 言う たい 死刑 反対 死刑 制度 廃止
"一息つくときによくTwitterのトレンドみてるんだけど死刑求刑ってあってなんの裁判かなーとか見ようと思ったらグロ画像
悪意は無いかもだけど酷いわな。
いや、悪意あるだろうな。
ケーキにしたってなんにしたっていい気分ではないことは確かだわ。",一息 つく とき トレンド みる る 死刑 求刑 ある 裁判 見る 思う グロだ 画像 悪意 無い 酷い 悪意 ある ケーキ したう なん する いい 気分 ない こと 確かだ
"RT @niigata_nippo: ［新潟日報ＰＤＦ号外］新潟女児殺害 死刑求刑
https://t.co/NZtKhSMeNG https://t.co/qtsIMddhaf",死刑 求刑
口リスキー（くちりすきー）さん死刑求刑されてる？,口 リスキー く ちり すきだ さん 死刑 求刑 する れる る
新潟女児殺害 被告に死刑求刑 人権団体はこんな人でも死刑にはせず新しい犠牲者を増やせと抗議するのかしら？自分達の身内がやられたとしても https://t.co/CWq70BDrRn,新潟 女児 殺害 被告 死刑 求刑 人権 団体 人 死刑 する 新しい 犠牲 者 増やす 抗議 する 自分 達 身内 やられる する
"理由が詳しく分からないのでなんとも言えないが、弁護人の量刑意見があまりにも軽すぎないか？あまりに軽すぎると評議で相手にされないという話もあると聞いたことがあるが…。

女児殺害事件 被告に死刑求刑｜NHK 首都圏のニュース   https://t.co/OtQactLZF8",理由 詳しい 分かる ない 言える ない 弁護人 量刑 意見 あまりだ 軽い すぎる ない あまりだ 軽い すぎる 評議 相手 する れる ない いう 話 ある 聞く こと ある 女児 殺害 事件 被告 死刑 求刑 首都 圏 ニュース
はぇ〜死刑求刑されてる被告人の弁護士もなぜか一緒に叩かれてるんか、大変な仕事じゃなぁ〜,はえ 死刑 求刑 する れる る 被告人 弁護 士 一緒だ 叩く れる るん 大変だ 仕事
"RT @duoas3313: 死刑求刑ってさ、税金で生かす期間が無駄だから死刑囚2人に銃渡して、相手を殺した方を次の死刑判決出るまで生かしてやるって制度にした方がいいと思うんだよね
税金もったいないし、とっとと死んで償わせるべきだしさ",死刑 求刑 税金 生かす 期間 無駄だ 死刑 囚 2 人 銃 渡す 相手 殺す 方 死刑 判決 出る 生かす やる 制度 する 方 いい 思う 税金 もったいない 死ぬ 償う せる しさ
"恐ろしい世の中だな
会ったこともない知らない人の死を望んでる人が何万人もいるのか
やったことがクソというのには完全に同意だけど死刑求刑はほぼ何も知らない第三者が軽々しく口に出していい事じゃない",恐ろしい 世の中 会う こと ない 知る ない 人 死 望む る 人 何万 人 いる やる こと いう 完全だ 同意 死刑 求刑 知る ない 第三者 軽々しい 口 出す いい 事 ない
"RT @yorozya_1: o(｀ω´*)o 死刑の求刑か  妥当だな！

新潟女児殺害、被告に死刑求刑「まれにみる非道な犯行」
新潟市西区で昨年５月、小学２年生の女児（当時７）が殺された事件の裁判員裁判が２２日 検察側は論告で 同区の元会社員、小林遼（はるか）被告（２５）に…",妥当だ 新潟 女児 殺害 被告 死刑 求刑 まれだ みる 非道だ 犯行 新潟 市 西 区 昨年 ５ 月 小学 ２ 年生 女児 当時 ７ 殺す れる 事件 裁判 員 裁判 ２２ 日 検察 側 論告 区 会社 員 小林 遼 はるか 被告 ２５
RT @Batogaru2388: おい！死刑求刑空気読め！！ https://t.co/o6ZKYGLvpM,
昔から死刑に関しては内容にかかわらずいくないという考えをもっているから、死刑求刑というのを見ると複雑な気分になるなあ,昔 死刑 関する 内容 かかわる いく ない いう 考え もつ いる 死刑 求刑 いう の 見る 複雑だ 気分 なる
"RT @superj_niigata: 【速報】新潟・西区女児殺害事件　裁判
検察が小林遼被告に死刑を求刑",速報 新潟 西 区 女児 殺害 事件 裁判 検察 小林 遼 被告 死刑 求刑
RT @shh_merry: そして死刑求刑とか物騒なタグがトレンド入りしてたからふーんと思って見てたんだけど突然グロ画像が出てきたので気を付けて…。作り物らしいけど普通にSAN値チェック…,死刑 求刑 物騒だ タグ トレンド 入り する たい ふん 思う 見る る グロい 画像 出る くる 気 付ける 作り 物 普通だ 値 チェック
"RT @Giulia1300GTA: 新潟女児殺害、死刑求刑　２５歳男に検察側 https://t.co/31IwWU0chX @Sankei_newsより

当たり前じゃ",当たり前だ
学校の行事中に教師が男子生徒を撲殺すると求刑懲役3年で、青年が屋外で幼女を絞殺すると求刑死刑なのは、よく分からない。,学校 行事 中 教師 男子 生徒 殺 する 求刑 懲役 3 年 青年 屋外 幼女 絞殺 する 求刑 死刑 よい 分かる ない
新潟市で昨年５月、当時小学２年生の女児が殺された事件で、検察側は被告(25歳の男性)に死刑を求刑。と言っても永山基準に照らし合わせ無期懲役になりそうだけど。少なくとも未成年者の殺人に対する刑罰は極刑が妥当と思う。そうでなければ御遺族が浮かばれない。永山基準は見直すべきと思う。,新潟 市 昨年 ５ 月 当時 小学 ２ 年生 女児 殺す れる 事件 検察 側 被告 25 歳 男性 死刑 求刑 言う 永山 基準 照らし合わせる 無期 懲役 なる そうだ 成年 者 殺人 対する 刑罰 極刑 妥当だ 思う ない 遺族 浮かぶ れる ない 永山 基準 見直す 思う
【イザ：社会ニュース】新潟女児殺害、死刑求刑　２５歳男に検察側 #イザ https://t.co/7X5PnEMZxd,イザ 社会 ニュース 新潟 女児 殺害 死刑 求刑 ２５ 歳 男 検察 側 イザ
"もう私が誰かに殺されたら
復讐しても子供は帰ってこないけど、復讐しなくても子供帰ってこないんだから捕まってでも娘を殺した犯人を自分の手で殺したいってママが言ってた！
家族としては死刑求刑が法に触れない1番納得出来る方法なんだろうな。",私 誰 殺す れる 復讐 する 子供 帰る くる ない 復讐 する ない 子供 帰る くる ない 捕まる 娘 殺す 犯人 自分 手 殺す いく ママ 言う たい 家族 する 死刑 求刑 法 触れる ない 1 番 納得 出来る 方法
【新潟女児殺害】「まれに見る犯行」被告に死刑求刑 https://t.co/3ATkLoSXqM #新潟女児殺害 #事件 #小林遼被告 #拡散,新潟 女児 殺害 まれだ 見る 犯行 被告 死刑 求刑 新潟 女児 殺害 事件 小林 遼 被告 拡散
